Meal,Category,Area,Instructions,MealThumb,Source,Ingredients
French Onion Soup,Side,French,"Melt the butter with the oil in a large heavy-based pan. Add the onions and fry with the lid on for 10 mins until soft. Sprinkle in the sugar and cook for 20 mins more, stirring frequently, until caramelised. The onions should be really golden, full of flavour and soft when pinched between your fingers. Take care towards the end to ensure that they don’t burn.
Add the garlic for the final few mins of the onions’ cooking time, then sprinkle in the flour and stir well. Increase the heat and keep stirring as you gradually add the wine, followed by the hot stock. Cover and simmer for 15-20 mins.
To serve, turn on the grill, and toast the bread. Ladle the soup into heatproof bowls. Put a slice or two of toast on top of the bowls of soup, and pile on the cheese. Grill until melted. Alternatively, you can complete the toasts under the grill, then serve them on top.",https://www.themealdb.com/images/media/meals/xvrrux1511783685.jpg,https://www.bbcgoodfood.com/recipes/3020694/french-onion-soup,"50g Butter, 1 tbs Olive Oil, 1 kg Onion, 1 tsp  Sugar, 4 sliced Garlic Clove, 2 tbs Plain Flour, 250ml Dry White Wine, 1L Beef Stock, 4 sliced Bread, 140g Gruyère,  ,  ,  ,  ,  ,  ,  ,  ,  ,  "
Beef Bourguignon,Beef,French,"Heat a large casserole pan and add 1 tbsp goose fat. Season the beef and fry until golden brown, about 3-5 mins, then turn over and fry the other side until the meat is browned all over, adding more fat if necessary. Do this in 2-3 batches, transferring the meat to a colander set over a bowl when browned.
In the same pan, fry the bacon, shallots or pearl onions, mushrooms, garlic and bouquet garni until lightly browned. Mix in the tomato purée and cook for a few mins, stirring into the mixture. This enriches the bourguignon and makes a great base for the stew. Then return the beef and any drained juices to the pan and stir through.
Pour over the wine and about 100ml water so the meat bobs up from the liquid, but isn’t completely covered. Bring to the boil and use a spoon to scrape the caramelised cooking juices from the bottom of the pan – this will give the stew more flavour.
Heat oven to 150C/fan 130C/gas 2. Make a cartouche: tear off a square of foil slightly larger than the casserole, arrange it in the pan so it covers the top of the stew and trim away any excess foil. Then cook for 3 hrs. If the sauce looks watery, remove the beef and veg with a slotted spoon, and set aside. Cook the sauce over a high heat for a few mins until the sauce has thickened a little, then return the beef and vegetables to the pan.
To make the celeriac mash, peel the celeriac and cut into cubes. Heat the olive oil in a large frying pan. Tip in the celeriac and fry for 5 mins until it turns golden. Season well with salt and pepper. Stir in the rosemary, thyme, bay and cardamom pods, then pour over 200ml water, enough to nearly cover the celeriac. Turn the heat to low, partially cover the pan and leave to simmer for 25-30 mins.
After 25-30 mins, the celeriac should be soft and most of the water will have evaporated. Drain away any remaining water, then remove the herb sprigs, bay and cardamom pods. Lightly crush with a potato masher, then finish with a glug of olive oil and season to taste. Spoon the beef bourguignon into serving bowls and place a large spoonful of the celeriac mash on top. Garnish with one of the bay leaves, if you like.",https://www.themealdb.com/images/media/meals/vtqxtu1511784197.jpg,https://www.bbcgoodfood.com/recipes/5032/beef-bourguignon,"3 tsp Goose Fat, 600g Beef Shin, 100g  Bacon, 350g Challots, 250g Chestnut Mushroom, 2 sliced Garlic Clove, 1 Bouquet Garni, 1 tbs Tomato Puree, 750 ml  Red Wine, 600g Celeriac, 2 tbs Olive Oil, sprigs of fresh Thyme, sprigs of fresh Rosemary, 2 Bay Leaf, 4 Cardamom,  ,  ,  ,  ,  "
Chocolate Souffle,Desert,French,"Heat oven to 220C/fan 200C/gas 7 and place a baking tray on the top shelf. For the sauce, heat the cream and sugar until boiling. Remove from the heat, stir in the chocolate and butter until melted, then keep warm.
Brush 6 x 150ml ramekins with melted butter, sprinkle with the 2 tbsp caster sugar, then tip out any excess. Melt the chocolate and cream in a bowl over a pan of simmering water, cool, then mix in the egg yolks. Whisk the egg whites until they hold their shape, then add the sugar, 1 tbsp at a time, whisking back to the same consistency. Mix a spoonful into the chocolate, then gently fold in the rest.
Working quickly, fill the ramekins, wipe the rims clean and run your thumb around the edges. Turn oven down to 200C/fan 180C/gas 6, place the ramekins onto the baking tray, then bake for 8-10 mins until risen with a slight wobble. Don’t open the oven door too early as this may make them collapse.
Once the soufflés are ready, dust with icing sugar, scoop a small hole from their tops, then pour in some of the hot chocolate sauce. Replace the lids and serve straight away.",https://www.themealdb.com/images/media/meals/twspvx1511784937.jpg,https://www.bbcgoodfood.com/recipes/5816/hot-chocolate-souffls-with-chocolate-cream-sauce,"142ml Single Cream, 25g Caster Sugar, 100g  Dark Chocolate, 25g Butter, drizzle Butter, 50g Caster Sugar, 175g Dark Chocolate, 2 tbs Double Cream, 4 Egg Yolks, 5 Egg White, 2 tbs Double Cream, to serve Icing Sugar,  ,  ,  ,  ,  ,  ,  ,  "
Flamiche,Vegetarian,French,"For the pastry, sift the flour and salt into the bowl of a food processor, add the butter and lard, then whizz together briefly until the mixture looks like fine breadcrumbs. Tip the mixture into a bowl, then stir in the cheese and enough of the water for the mixture to come together. Tip out onto a lightly floured surface and knead briefly until smooth. Roll out thinly and line a 23cm x 4cm loose-?bottomed fluted flan tin. Prick the base with a fork. Chill for 20 minutes.
02.Melt the 75g butter in a saucepan over a low heat, then add the leeks and the salt. Cover and cook for ?10 minutes until soft. Uncover the pan, increase the heat and cook ?for 2 minutes, stirring occasionally, until the liquid has evaporated. Spoon onto a plate and leave to cool.
03.Preheat the oven to 200°C/fan180°C/gas 6. Line the pastry case with baking paper and baking beans or rice and blind bake for 15-20 minutes until the edges are biscuit-coloured. Remove the paper and beans/rice and return the case to the oven for 7-10 minutes until the base is crisp and lightly golden. Remove and set aside. Reduce the oven temperature to 190°C/fan170°C/gas 5.
04.Put the crème fraîche into a bowl with the whole egg, egg yolks and nutmeg. Lightly beat together, then season. Stir in the leeks. Spoon ?the mixture into the tart case and bake for 35-40 minutes until set ?and lightly golden. Remove from ?the oven and leave for 10 minutes. Take out of the tin and serve.",https://www.themealdb.com/images/media/meals/wssvvs1511785879.jpg,http://www.deliciousmagazine.co.uk/recipes/flamiche-flemish-leek-tart/,"75g Butter, 1kg Leek, ½ tsp Salt, 300ml  Creme Fraiche, 1 Egg, 3 Egg Yolks, ¼ teaspoon Nutmeg, 225g Plain Flour, ½ tsp Salt, 60g Butter, 60g Lard, 50g Cheddar Cheese, 2 tbs Water,  ,  ,  ,  ,  ,  ,  "
Duck Confit,Miscellaneous,French,"The day before you want to make the dish, scatter half the salt, half the garlic and half of the herbs over the base of a small shallow dish. Lay the duck legs, skin-side up, on top, then scatter over the remaining salt, garlic and herbs. Cover the duck and refrigerate overnight. This can be done up to 2 days ahead.
Pour the wine into a saucepan that will snugly fit the duck legs in a single layer. Brush the salt off the duck legs and place them, skin-side down, in the wine. Cover the pan with a lid and place over a medium heat. As soon as the wine starts to bubble, turn the heat down to the lowest setting and cook for 2 hours, checking occasionally that the liquid is just barely simmering. (If you own a heat diffuser, it would be good to use it here.) After 2 hours, the duck legs should be submerged in their own fat and the meat should feel incredibly tender when prodded. Leave to cool.
The duck legs are now cooked and can be eaten immediately – or you can follow the next step if you like them crisp. If you are preparing ahead, pack the duck legs tightly into a plastic container or jar and pour over the fat, but not the liquid at the bottom of the pan. Cover and leave in the fridge for up to a month, or freeze for up to 3 months. The liquid you are left with makes a tasty gravy, which can be chilled or frozen until needed.
To reheat and crisp up the duck legs, heat oven to 220C/fan 200C/gas 7. Remove the legs from the fat and place them, skin-side down, in an ovenproof frying pan. Roast for 30-40 mins, turning halfway through, until brown and crisp. Serve with the reheated gravy, a crisp salad and some crisp golden ptoatoes.",https://www.themealdb.com/images/media/meals/wvpvsu1511786158.jpg,https://www.bbcgoodfood.com/recipes/2085/barneys-confit-of-duck,"Handful Sea Salt, 4 Bay Leaf, 4 cloves Garlic, Handful Thyme, 4 Duck Legs, 100ml White Wine,  ,  ,  ,  ,  ,  ,  ,  ,  ,  ,  ,  ,  ,  "
Ratatouille,Vegetarian,French,"Cut the aubergines in half lengthways. Place them on the board, cut side down, slice in half lengthways again and then across into 1.5cm chunks. Cut off the courgettes ends, then across into 1.5cm slices. Peel the peppers from stalk to bottom. Hold upright, cut around the stalk, then cut into 3 pieces. Cut away any membrane, then chop into bite-size chunks.
Score a small cross on the base of each tomato, then put them into a heatproof bowl. Pour boiling water over the tomatoes, leave for 20 secs, then remove. Pour the water away, replace the tomatoes and cover with cold water. Leave to cool, then peel the skin away. Quarter the tomatoes, scrape away the seeds with a spoon, then roughly chop the flesh.
Set a sauté pan over medium heat and when hot, pour in 2 tbsp olive oil. Brown the aubergines for 5 mins on each side until the pieces are soft. Set them aside and fry the courgettes in another tbsp oil for 5 mins, until golden on both sides. Repeat with the peppers. Don’t overcook the vegetables at this stage, as they have some more cooking left in the next step.
Tear up the basil leaves and set aside. Cook the onion in the pan for 5 mins. Add the garlic and fry for a further min. Stir in the vinegar and sugar, then tip in the tomatoes and half the basil. Return the vegetables to the pan with some salt and pepper and cook for 5 mins. Serve with basil.",https://www.themealdb.com/images/media/meals/wrpwuu1511786491.jpg,https://www.bbcgoodfood.com/recipes/2903/ratatouille,"2 large Aubergine, 4 Courgettes, 2 Yellow Pepper, 4 large Tomato, 5 tbs Olive Oil, Bunch Basil, 1 medium Onion, 3 finely chopped Garlic Clove, 1 tsp  Red Wine Vinegar, 1 tsp  Sugar,  ,  ,  ,  ,  ,  ,  ,  ,  ,  "
Tarte Tatin,Desert,French,"Roll the pastry to a 3mm-thick round on a lightly floured surface and cut a 24cm circle, using a plate as a guide. Lightly prick all over with a fork, wrap in cling film on a baking sheet and freeze while preparing the apples.
Heat oven to 180C/160C fan/gas 4. Peel, quarter and core the apples. Put the sugar in a flameproof 20cm ceramic Tatin dish or a 20cm ovenproof heavy-based frying pan and place over a medium-high heat. Cook the sugar for 5-7 mins to a dark amber caramel syrup that’s starting to smoke, then turn off the heat and stir in the 60g diced chilled butter.
To assemble the Tarte Tatin, arrange the apple quarters very tightly in a circle around the edge of the dish first, rounded-side down, then fill in the middle in a similar fashion. Gently press with your hands to ensure there are no gaps. Brush the fruit with the melted butter.
Bake in the oven for 30 mins, then remove and place the disc of frozen puff pastry on top – it will quickly defrost. Tuck the edges down the inside of the dish and, with a knife, prick a few holes in the pastry to allow steam to escape. Bake for a further 40-45 mins until the pastry is golden brown and crisp.
Allow to cool to room temperature for 1 hr before running a knife around the edge of the dish and inverting it onto a large serving plate that is deep enough to contain the juices. Serve with crème fraîche or vanilla ice cream.",https://www.themealdb.com/images/media/meals/ryspuw1511786688.jpg,https://www.bbcgoodfood.com/recipes/tarte-tatin,"300g Puff Pastry, Dusting Plain Flour, 6 Braeburn Apples, 100g  Caster Sugar, 85g Butter, to serve Creme Fraiche,  ,  ,  ,  ,  ,  ,  ,  ,  ,  ,  ,  ,  ,  "
Chinon Apple Tarts,Desert,French,"To make the red wine jelly, put the red wine, jam sugar, star anise, clove, cinnamon stick, allspice, split vanilla pod and seeds in a medium saucepan. Stir together, then heat gently to dissolve the sugar. Turn up the heat and boil for 20 mins until reduced and syrupy. Strain into a small, sterilised jam jar and leave to cool completely. Will keep in the fridge for up to 1 month.

Take the pastry out of the fridge and leave at room temperature for 10 mins, then unroll. Heat the grill to high and heat the oven to 180C/160C fan/gas 4. Cut out 2 x 13cm circles of pastry, using a plate as a guide, and place on a non-stick baking sheet. Sprinkle each circle with 1 tbsp sugar and grill for 5 mins to caramelise, watching carefully so that the sugar doesn’t burn. Remove from the grill. Can be done a few hours ahead, and left, covered, out of the fridge.

Peel, quarter and core the apples, cut into 2mm-thin slices and arrange on top of the pastry. Sprinkle over the remaining sugar and pop in the oven for 20-25 mins until the pastry is cooked through and golden, and the apples are softened. Remove and allow to cool slightly. Warm 3 tbsp of the red wine jelly in a small pan over a low heat with 1 tsp water to make it a little more runny, then brush over the top of the tarts.

Tip the crème fraîche into a bowl, sift over the icing sugar and cardamom, and mix together. Carefully lift the warm tarts onto serving plates and serve with the cardamom crème fraîche.",https://www.themealdb.com/images/media/meals/qtqwwu1511792650.jpg,https://www.bbcgoodfood.com/recipes/chinon-apple-tarts,"320g Puff Pastry, 4 tbs Dark Brown Soft Sugar, 3 Braeburn Apples, 4 tbs Red Wine Jelly, 100ml Creme Fraiche, 1 tbs Icing Sugar, 3 Cardamom,  ,  ,  ,  ,  ,  ,  ,  ,  ,  ,  ,  ,  "
Summer Pistou,Vegetarian,French,"Heat the oil in a large pan and fry the leeks and courgette for 5 mins to soften. Pour in the stock, add three-quarters of the haricot beans with the green beans, half the tomatoes, and simmer for 5-8 mins until the vegetables are tender.
Meanwhile, blitz the remaining beans and tomatoes, the garlic and basil in a food processor (or in a bowl with a stick blender) until smooth, then stir in the Parmesan. Stir the sauce into the soup, cook for 1 min, then ladle half into bowls or pour into a flask for a packed lunch. Chill the remainder. Will keep for a couple of days.",https://www.themealdb.com/images/media/meals/rqtxvr1511792990.jpg,https://www.bbcgoodfood.com/recipes/summer-pistou,"1 tbs Rapeseed Oil, 2 finely chopped Leek, 1 large Courgettes, 1L Vegetable Stock, 400g Cannellini Beans, 200g Green Beans, 3 chopped Tomatoes, 3 chopped Garlic Clove, Small pack Basil, 40g Parmesan,  ,  ,  ,  ,  ,  ,  ,  ,  ,  "
Three-cheese souffles,Miscellaneous,French,"Heat oven to 200C/180C fan/ gas 6 and butter 4 small (about 200ml) ramekins. Sprinkle the Parmesan into the ramekins, turning until all sides are covered. Place the milk and bay leaves in a large saucepan over a gentle heat and bring to the boil. Turn off the heat and leave to infuse for 15 mins.
Discard the bay leaves, add the butter and flour, and return to a low heat. Very gently simmer, stirring continuously with a balloon whisk, for about 6 mins until you get a smooth, thick white sauce. Make sure that you get right into the corners of the pan to stop the sauce from catching or becoming lumpy.
Once thickened, transfer the sauce to a large bowl and stir in the mustard powder, cayenne pepper, Gruyère and egg yolks until fully combined.
In a spotlessly clean bowl and with a clean whisk, beat the egg whites just until peaks begin to form.
Carefully fold the egg whites into the cheese sauce in three stages making sure you fold, rather than stir, to keep the egg whites light and airy. Fill the prepared ramekins with the soufflé mix.
Top each soufflé with a slice of goat’s cheese, then place on a baking tray. Bake for 20-25 mins or until springy and well risen but cooked through.
Leave to cool, then run a knife around the edge of each dish and remove the soufflés. If preparing in advance, place soufflés upside down (for neat presentation), on a tray. Cover tray in cling film. Chill for a few days or freeze for up to 1 month.
When ready to re-bake, heat oven to 200C/180C fan/gas 6. Place the upside-down soufflés in a shallow baking dish, top with the remaining goat’s cheese slices and pour over the cream (this stops them from drying out when baked for the second time). Cook for 8-10 mins until golden. Serve immediately alongside some simply dressed salad.",https://www.themealdb.com/images/media/meals/sxwquu1511793428.jpg,https://www.bbcgoodfood.com/recipes/3028701/threecheese-souffls,"50g Butter, 25g Parmesan, 300ml  Milk, 2 Bay Leaves, 5 tbs Plain Flour, ½ tsp English Mustard, Pod of Cayenne Pepper, 140g Gruyère, 3 Eggs, 8 slices Goats Cheese, 150ml Double Cream, to serve Spinach,  ,  ,  ,  ,  ,  ,  ,  "
Brie wrapped in prosciutto & brioche,Side,French,"Mix the flour, 1 tsp salt, caster sugar, yeast, milk and eggs together in a mixer using the dough attachment for 5 mins until the dough is smooth. Add the butter and mix for a further 4 mins on medium speed. Scrape the dough bowl and mix again for 1 min. Place the dough in a container, cover with cling film and leave in the fridge for at least 6 hrs before using.
Wrap the Brie in the prosciutto and set aside. Turn out the dough onto a lightly floured surface. Roll into a 25cm circle. Place the wrapped Brie in the middle of the circle and fold the edges in neatly. Put the parcel onto a baking tray lined with baking parchment and brush with beaten egg. Chill in the fridge for 30 mins, then brush again with beaten egg and chill for a further 30 mins. Leave to rise for 1 hr at room temperature. Heat oven to 200C/180C fan/gas 6, then bake for 22 mins. Serve warm.",https://www.themealdb.com/images/media/meals/qqpwsy1511796276.jpg,https://www.bbcgoodfood.com/recipes/1803634/brie-wrapped-in-prosciutto-and-brioche,"375g Plain Flour, 50g Caster Sugar, 7g Yeast, 75g Milk, 3 Large Eggs, To Glaze Eggs, 180g Butter, 250g Brie, 8 slices Prosciutto,  ,  ,  ,  ,  ,  ,  ,  ,  ,  ,  "
Boulangère Potatoes,Side,French,"Heat oven to 200C/fan 180C/gas 6. Fry the onions and thyme sprigs in the oil until softened and lightly coloured (about 5 mins).
Spread a layer of potatoes over the base of a 1.5-litre oiled gratin dish. Sprinkle over a few onions (see picture, above) and continue layering, finishing with a layer of potatoes. Pour over the stock and bake for 50-60 mins until the potatoes are cooked and the top is golden and crisp.",https://www.themealdb.com/images/media/meals/qywups1511796761.jpg,https://www.bbcgoodfood.com/recipes/5056/boulangre-potatoes,"2 finely chopped Onions, sprigs of fresh Thyme, 2 tbs Olive Oil, 1.5kg Potatoes, 425g Vegetable Stock,  ,  ,  ,  ,  ,  ,  ,  ,  ,  ,  ,  ,  ,  ,  "
French Omelette,Miscellaneous,French,"Get everything ready. Warm a 20cm (measured across the top) non-stick frying pan on a medium heat. Crack the eggs into a bowl and beat them with a fork so they break up and mix, but not as completely as you would for scrambled egg. With the heat on medium-hot, drop one knob of butter into the pan. It should bubble and sizzle, but not brown. Season the eggs with the Parmesan and a little salt and pepper, and pour into the pan.
Let the eggs bubble slightly for a couple of seconds, then take a wooden fork or spatula and gently draw the mixture in from the sides of the pan a few times, so it gathers in folds in the centre. Leave for a few seconds, then stir again to lightly combine uncooked egg with cooked. Leave briefly again, and when partly cooked, stir a bit faster, stopping while there’s some barely cooked egg left. With the pan flat on the heat, shake it back and forth a few times to settle the mixture. It should slide easily in the pan and look soft and moist on top. A quick burst of heat will brown the underside.
Grip the handle underneath. Tilt the pan down away from you and let the omelette fall to the edge. Fold the side nearest to you over by a third with your fork, and keep it rolling over, so the omelette tips onto a plate – or fold it in half, if that’s easier. For a neat finish, cover the omelette with a piece of kitchen paper and plump it up a bit with your fingers. Rub the other knob of butter over to glaze. Serve immediately.",https://www.themealdb.com/images/media/meals/yvpuuy1511797244.jpg,https://www.bbcgoodfood.com/recipes/1669/ultimate-french-omelette,"3 Eggs, 2 knobs Butter, 1 tsp  Parmesan, 3 chopped Tarragon, 1 tbs chopped Parsley, 1 tbs chopped Chives, 4 tbs Gruyère,  ,  ,  ,  ,  ,  ,  ,  ,  ,  ,  ,  ,  "
Pear Tarte Tatin,Desert,French,"Core the pears, then peel as neatly as possible and halve. If you like, they can be prepared up to a day ahead and kept in the fridge, uncovered, so that they dry out.
Tip the sugar, butter, star anise, cardamom and cinnamon into an ovenproof frying pan, about 20cm wide, and place over a high heat until bubbling. Shake the pan and stir the buttery sauce until it separates and the sugar caramelises to a toffee colour.
Lay the pears in the pan, then cook in the sauce for 10-12 mins, tossing occasionally, until completely caramelised. Don’t worry about them burning – they won’t – but you want to caramelise them as much as possible. Splash in the brandy and let it flambé, then set the pears aside.
Heat oven to 200C/fan 180C/gas 6. Roll the pastry out to the thickness of a £1 coin. Using a plate slightly larger than the top of the pan, cut out a circle, then press the edges of the circle of pastry to thin them out.
When the pears have cooled slightly, arrange them in the pan, cut side up, in a floral shape, with the pears around the edge pointing inwards. Rest the cinnamon stick on the top in the centre, with the cardamom pods scattered around.
Drape the pastry over the pears, then tuck the edges down the pan sides and under the fruit (see Gordon’s guide). Pierce the pastry a few times, then bake for 15 mins. If a lot of juice bubbles up the side of the pan, pour it off at this stage (see guide). Reduce oven to 180C/fan 160C/gas 4 and bake for 15 mins more until the pastry is golden. Leave the tart to stand for 10 mins, then invert it carefully onto a serving dish.",https://www.themealdb.com/images/media/meals/rxvxrr1511797671.jpg,https://www.bbcgoodfood.com/recipes/4778/pear-tarte-tatin,"8 Pears, 100g  Caster Sugar, 100g  Butter, 2 Star Anise, 3 Pods Cardamom, 1 large Cinnamon, 2 tbs Brandy, 500g Puff Pastry,  ,  ,  ,  ,  ,  ,  ,  ,  ,  ,  ,  "
White chocolate creme brulee,Desert,French,"Heat the cream, chocolate and vanilla pod in a pan until the chocolate has melted. Take off the heat and allow to infuse for 10 mins, scraping the pod seeds into the cream. If using the vanilla extract, add straight away. Heat oven to 160C/fan 140C/gas 3.
Beat yolks and sugar until pale. stir in the chocolate cream. Strain into a jug and pour into ramekins. Place in a deep roasting tray and pour boiling water halfway up the sides. Bake for 15-20 mins until just set with a wobbly centre. Chill in the fridge for at least 4 hrs.
To serve, sprinkle some sugar on top of the brûlées and caramelise with a blowtorch or briefly under a hot grill. Leave caramel to harden, then serve.",https://www.themealdb.com/images/media/meals/uryqru1511798039.jpg,https://www.bbcgoodfood.com/recipes/2540/white-chocolate-crme-brle,"568ml Double Cream, 100g  White Chocolate Chips, Pod of Vanilla, 6 Egg Yolks, 2 tbs Caster Sugar, Top Caster Sugar,  ,  ,  ,  ,  ,  ,  ,  ,  ,  ,  ,  ,  ,  "
