Meal,Category,Area,Instructions,MealThumb,Source,Ingredients
Garides Saganaki,Seafood,Greek,"Place the prawns in a pot and add enough water to cover. Boil for 5 minutes. Drain, reserving the liquid, and set aside.
Heat 2 tablespoons of oil in a saucepan. Add the onion; cook and stir until soft. Mix in the parsley, wine, tomatoes, garlic and remaining olive oil. Simmer, stirring occasionally, for about 30 minutes, or until the sauce is thickened.
While the sauce is simmering, the prawns should become cool enough to handle. First remove the legs by pinching them, and then pull off the shells, leaving the head and tail on.
When the sauce has thickened, stir in the prawns. Bring to a simmer again if the sauce has cooled with the prawns, and cook for about 5 minutes. Add the feta and remove from the heat. Let stand until the cheese starts to melt. Serve warm with slices of crusty bread.
Though completely untraditional, you can add a few tablespoons of stock or passata to this recipe to make a delicious pasta sauce. Toss with pasta after adding the feta, and serve.",https://www.themealdb.com/images/media/meals/wuvryu1468232995.jpg,,"500g Raw king prawns, 3 tablespoons Olive oil, 1 Chopped onion, pinch Freshly chopped parsley, 250ml White wine, 1 (400g) tin Chopped tomatoes, 1/2 teaspoon Minced garlic, 1 (200g) pack Cubed Feta cheese,  ,  ,  ,  ,  ,  ,  ,  ,  ,  ,  ,  "
Chicken Enchilada Casserole,Chicken,Mexican,"Cut each chicken breast in about 3 pieces, so that it cooks faster and put it in a small pot. Pour Enchilada sauce over it and cook covered on low to medium heat until chicken is cooked through, about 20 minutes. No water is needed, the chicken will cook in the Enchilada sauce. Make sure you stir occasionally so that it doesn't stick to the bottom.
Remove chicken from the pot and shred with two forks.
Preheat oven to 375 F degrees.
Start layering the casserole. Start with about ¼ cup of the leftover Enchilada sauce over the bottom of a baking dish. I used a longer baking dish, so that I can put 2 corn tortillas across. Place 2 tortillas on the bottom, top with ⅓ of the chicken and ⅓ of the remaining sauce. Sprinkle with ⅓ of the cheese and repeat starting with 2 more tortillas, then chicken, sauce, cheese. Repeat with last layer with the remaining ingredients, tortillas, chicken, sauce and cheese.
Bake for 20 to 30 minutes uncovered, until bubbly and cheese has melted and started to brown on top.
Serve warm.",https://www.themealdb.com/images/media/meals/qtuwxu1468233098.jpg,,"14 oz jar Enchilada sauce, 3 Cups shredded Monterey Jack cheese, 6 corn tortillas, 2 chicken breasts,  ,  ,  ,  ,  ,  ,  ,  ,  ,  ,  ,  ,  ,  ,  ,  "
Bakewell tart,Desert,British,"To make the pastry, measure the flour into a bowl and rub in the butter with your fingertips until the mixture resembles fine breadcrumbs. Add the water, mixing to form a soft dough.
Roll out the dough on a lightly floured work surface and use to line a 20cm/8in flan tin. Leave in the fridge to chill for 30 minutes.
Preheat the oven to 200C/400F/Gas 6 (180C fan).
Line the pastry case with foil and fill with baking beans. Bake blind for about 15 minutes, then remove the beans and foil and cook for a further five minutes to dry out the base.
For the filing, spread the base of the flan generously with raspberry jam.
Melt the butter in a pan, take off the heat and then stir in the sugar. Add ground almonds, egg and almond extract. Pour into the flan tin and sprinkle over the flaked almonds.
Bake for about 35 minutes. If the almonds seem to be browning too quickly, cover the tart loosely with foil to prevent them burning.",https://www.themealdb.com/images/media/meals/wyrqqq1468233628.jpg,,"175g/6oz plain flour, 75g/2½oz chilled butter, 2-3 tbsp cold water, 1 tbsp raspberry jam, 125g/4½oz butter, 125g/4½oz caster sugar, 125g/4½oz ground almonds, 1 free-range egg, beaten, ½ tsp almond extract, 50g/1¾oz flaked almonds,  ,  ,  ,  ,  ,  ,  ,  ,  ,  "
Apple Frangipan Tart,Desert,British,"Preheat the oven to 200C/180C Fan/Gas 6.
Put the biscuits in a large re-sealable freezer bag and bash with a rolling pin into fine crumbs. Melt the butter in a small pan, then add the biscuit crumbs and stir until coated with butter. Tip into the tart tin and, using the back of a spoon, press over the base and sides of the tin to give an even layer. Chill in the fridge while you make the filling.
Cream together the butter and sugar until light and fluffy. You can do this in a food processor if you have one. Process for 2-3 minutes. Mix in the eggs, then add the ground almonds and almond extract and blend until well combined.
Peel the apples, and cut thin slices of apple. Do this at the last minute to prevent the apple going brown. Arrange the slices over the biscuit base. Spread the frangipane filling evenly on top. Level the surface and sprinkle with the flaked almonds.
Bake for 20-25 minutes until golden-brown and set.
Remove from the oven and leave to cool for 15 minutes. Remove the sides of the tin. An easy way to do this is to stand the tin on a can of beans and push down gently on the edges of the tin.
Transfer the tart, with the tin base attached, to a serving plate. Serve warm with cream, crème fraiche or ice cream.",https://www.themealdb.com/images/media/meals/wxywrq1468235067.jpg,,"175g/6oz digestive biscuits, 75g/3oz butter, 200g/7oz Bramley apples, 75g/3oz butter, softened, 75g/3oz caster sugar, 2 free-range eggs, beaten, 75g/3oz ground almonds, 1 tsp almond extract, 50g/1¾oz flaked almonds,  ,  ,  ,  ,  ,  ,  ,  ,  ,  ,  "
Kapsalon,Lamb,Dutch,"Cut the meat into strips. Heat oil in a pan and fry the strips for 6 minutes until it's ready.
Bake the fries until golden brown in a deep fryrer. When ready transfer to a backing dish. Make sure the fries are spread over the whole dish.
Cover the fries with a new layer of meat and spread evenly.
Add a layer of cheese over the meat. You can also use grated cheese. When done put in the oven for a few minutes until the cheese is melted.
Chop the lettuce, tomato and cucumber in small pieces and mix together. for a basic salad. As extra you can add olives jalapenos and a red union.
Dived the salad over the dish and Serve with garlicsauce and hot sauce",https://www.themealdb.com/images/media/meals/sxysrt1468240488.jpg,,"250 Grams Fries, 500 Grams Doner Meat, Topping Garlic sauce, Topping Hotsauce, 1 Bulb Lettuce, 1 Tomato, 3rd Cucumber, 100 Grams Gouda cheese,  ,  ,  ,  ,  ,  ,  ,  ,  ,  ,  ,  "
Spaghetti Bolognese,Beef,Italian,"Put the onion and oil in a large pan and fry over a fairly high heat for 3-4 mins. Add the garlic and mince and fry until they both brown. Add the mushrooms and herbs, and cook for another couple of mins.

Stir in the tomatoes, beef stock, tomato ketchup or purée, Worcestershire sauce and seasoning. Bring to the boil, then reduce the heat, cover and simmer, stirring occasionally, for 30 mins.

Meanwhile, cook the spaghetti in a large pan of boiling, salted water, according to packet instructions. Drain well, run hot water through it, put it back in the pan and add a dash of olive oil, if you like, then stir in the meat sauce. Serve in hot bowls and hand round Parmesan cheese, for sprinkling on top.",https://www.themealdb.com/images/media/meals/sutysw1468247559.jpg,,"2 onions, 1tbsp olive oil, 1 clove garlic, 500g lean minced beef, 90g mushrooms, 1tsp dried oregano, 400g can tomatoes, 300ml hot beef stock, 1tbsp tomato puree, 1tbsp worcestershire sauce, 350g spaghetti, Topping parmesan,  ,  ,  ,  ,  ,  ,  ,  "
Spicy Arrabiata Penne,Vegetarian,Italian,"Bring a large pot of water to a boil. Add kosher salt to the boiling water, then add the pasta. Cook according to the package instructions, about 9 minutes.
In a large skillet over medium-high heat, add the olive oil and heat until the oil starts to shimmer. Add the garlic and cook, stirring, until fragrant, 1 to 2 minutes. Add the chopped tomatoes, red chile flakes, Italian seasoning and salt and pepper to taste. Bring to a boil and cook for 5 minutes. Remove from the heat and add the chopped basil.
Drain the pasta and add it to the sauce. Garnish with Parmigiano-Reggiano flakes and more basil and serve warm.",https://www.themealdb.com/images/media/meals/ustsqw1468250014.jpg,,"1 pound penne rigate, 1/4 cup olive oil, 3 cloves garlic, 1 tin  chopped tomatoes, 1/2 teaspoon red chile flakes, 1/2 teaspoon italian seasoning, 6 leaves basil, spinkling Parmigiano-Reggiano,  ,  ,  ,  ,  ,  ,  ,  ,  ,  ,  ,  "
Teriyaki Chicken Casserole,Chicken,Japanese,"Preheat oven to 350° F. Spray a 9x13-inch baking pan with non-stick spray.
Combine soy sauce, ½ cup water, brown sugar, ginger and garlic in a small saucepan and cover. Bring to a boil over medium heat. Remove lid and cook for one minute once boiling.
Meanwhile, stir together the corn starch and 2 tablespoons of water in a separate dish until smooth. Once sauce is boiling, add mixture to the saucepan and stir to combine. Cook until the sauce starts to thicken then remove from heat.
Place the chicken breasts in the prepared pan. Pour one cup of the sauce over top of chicken. Place chicken in oven and bake 35 minutes or until cooked through. Remove from oven and shred chicken in the dish using two forks.
*Meanwhile, steam or cook the vegetables according to package directions.
Add the cooked vegetables and rice to the casserole dish with the chicken. Add most of the remaining sauce, reserving a bit to drizzle over the top when serving. Gently toss everything together in the casserole dish until combined. Return to oven and cook 15 minutes. Remove from oven and let stand 5 minutes before serving. Drizzle each serving with remaining sauce. Enjoy!",https://www.themealdb.com/images/media/meals/wvpsxx1468256321.jpg,,"3/4 cup soy sauce, 1/2 cup water, 1/4 cup brown sugar, 1/2 teaspoon ground ginger, 1/2 teaspoon minced garlic, 4 Tablespoons cornstarch, 2 chicken breasts, 1 (12 oz.) stir-fry vegetables, 3 cups brown rice,  ,  ,  ,  ,  ,  ,  ,  ,  ,  ,  "
Honey Teriyaki Salmon,Seafood,Japanese,"Mix all the ingredients in the Honey Teriyaki Glaze together. Whisk to blend well. Combine the salmon and the Glaze together.

Heat up a skillet on medium-low heat. Add the oil, Pan-fry the salmon on both sides until it’s completely cooked inside and the glaze thickens.

Garnish with sesame and serve immediately.",https://www.themealdb.com/images/media/meals/xxyupu1468262513.jpg,,"1 lb Salmon, 1 tablespoon Olive oil, 2 tablespoons Soy Sauce, 2 tablespoons Sake, 4 tablespoons Sesame Seed,  ,  ,  ,  ,  ,  ,  ,  ,  ,  ,  ,  ,  ,  ,  "
Pad See Ew,Chicken,Thai,"Mix Sauce in small bowl.
Mince garlic into wok with oil. Place over high heat, when hot, add chicken and Chinese broccoli stems, cook until chicken is light golden.
Push to the side of the wok, crack egg in and scramble. Don't worry if it sticks to the bottom of the wok - it will char and which adds authentic flavour.
Add noodles, Chinese broccoli leaves and sauce. Gently mix together until the noodles are stained dark and leaves are wilted. Serve immediately!",https://www.themealdb.com/images/media/meals/uuuspp1468263334.jpg,,"6oz/180g rice stick noodles, 2 tbsp dark soy sauce, 2 tbsp oyster sauce, 2 tsp soy sauce, 2 tsp white vinegar, 2 tsp sugar, 2 tbsp water, 2 tbsp peanut oil, 2 cloves garlic, 1 cup Chicken, 1 Egg, 4 cups Chinese broccoli,  ,  ,  ,  ,  ,  ,  ,  "
Vegan Lasagna,Vegan,Italian,"1) Preheat oven to 180 degrees celcius. 
2) Boil vegetables for 5-7 minutes, until soft. Add lentils and bring to a gentle simmer, adding a stock cube if desired. Continue cooking and stirring until the lentils are soft, which should take about 20 minutes. 
3) Blanch spinach leaves for a few minutes in a pan, before removing and setting aside. 
4) Top up the pan with water and cook the lasagne sheets. When cooked, drain and set aside.
5) To make the sauce, melt the butter and add the flour, then gradually add the soya milk along with the mustard and the vinegar. Cook and stir until smooth and then assemble the lasagne as desired in a baking dish. 
6) Bake in the preheated oven for about 25 minutes.",https://www.themealdb.com/images/media/meals/rvxxuy1468312893.jpg,,"1 cups green red lentils, 1 carrot, 1 onion, 1 small zucchini, sprinking coriander, 150g spinach, 10 lasagne sheets, 35g vegan butter, 4 tablespoons flour, 300ml soya milk, 1.5 teaspoons mustard, 1 teaspoon vinegar,  ,  ,  ,  ,  ,  ,  ,  "
Chocolate Gateau,Desert,French,"Preheat the oven to 180°C/350°F/Gas Mark 4. Grease and line the base of an 8 in round spring form cake tin with baking parchment
Break the chocolate into a heatproof bowl and place over a saucepan of gently simmering water and stir until it melts. (or melt in the microwave for 2-3 mins stirring occasionally)
Place the butter and sugar in a mixing bowl and cream together with a wooden spoon until light and fluffy. Gradually beat in the eggs, adding a little flour if the mixture begins to curdle. Fold in the remaining flour with the cooled, melted chocolate and milk. Mix until smooth.
Spread the mixture into the cake tin and bake for 50-55 mins or until firm in the centre and a skewer comes out cleanly. Cool for 10 minutes, then turn out and cool completely.",https://www.themealdb.com/images/media/meals/tqtywx1468317395.jpg,http://www.goodtoknow.co.uk/recipes/536028/chocolate-gateau,"250g Plain chocolate, 175g Butter, 2 tablespoons Milk, 5 Eggs, 175g Granulated Sugar, 125g Flour,  ,  ,  ,  ,  ,  ,  ,  ,  ,  ,  ,  ,  ,  "
Mediterranean Pasta Salad,Chicken,Italian,"Bring a large saucepan of salted water to the boil
Add the pasta, stir once and cook for about 10 minutes or as directed on the packet.
Meanwhile, wash the tomatoes and cut into quarters. Slice the olives. Wash the basil.
Put the tomatoes into a salad bowl and tear the basil leaves over them. Add a tablespoon of olive oil and mix.
When the pasta is ready, drain into a colander and run cold water over it to cool it quickly.
Toss the pasta into the salad bowl with the tomatoes and basil.
Add the sliced olives, drained mozzarella balls, and chunks of tuna. Mix well and let the salad rest for at least half an hour to allow the flavours to mingle.
Sprinkle the pasta with a generous grind of black pepper and drizzle with the remaining olive oil just before serving.",https://www.themealdb.com/images/media/meals/wvqpwt1468339226.jpg,https://thelemonsqueezy.com/recipe/mediterranean-pasta-salad/,"200 g mozzarella balls, 250 g baby plum tomatoes, 1  bunch fresh basil, 350 g farfalle, 3  tablespoons extra virgin olive oil, 40 g Green Olives, 200 g tuna, to taste salt, to taste pepper,  ,  ,  ,  ,  ,  ,  ,  ,  ,  ,  "
Cream Cheese Tart,Starter,Unknown,"Crust: make a dough from 250g flour (I like mixing different flours like plain and wholegrain spelt flour), 125g butter, 1 egg and a pinch of salt, press it into a tart form and place it in the fridge. Filling: stir 300g cream cheese and 100ml milk until smooth, add in 3 eggs, 100g grated parmesan cheese and season with salt, pepper and nutmeg. Take the crust out of the fridge and prick the bottom with a fork. Pour in the filling and bake at 175 degrees C for about 25 minutes. Cover the tart with some aluminium foil after half the time. In the mean time, slice about 350g mini tomatoes. In a small pan heat 3tbsp olive oil, 3tbsp white vinegar, 1 tbsp honey, salt and pepper and combine well. Pour over the tomato slices and mix well. With a spoon, place the tomato slices on the tart, avoiding too much liquid on it. Decorate with basil leaves and enjoy",https://www.themealdb.com/images/media/meals/wurrux1468416624.jpg,https://www.instagram.com/p/BHyuMZ1hZX0,"250g Flour, 125g Butter, 1 Egg, Pinch Salt, 300g Cheese, 100ml milk Milk, 3 Eggs, 100g Parmesan Cheese, 350g Plum tomatoes, 3tbsp White Vinegar, 1 tbsp Honey, Topping Basil,  ,  ,  ,  ,  ,  ,  ,  "
Potato Gratin with Chicken,Chicken,Unknown,"15 minute potato gratin with chicken and bacon greens: a gratin always seems more effort and more indulgent than ordinary boiled or roasts, but it doesn't have to take 45mins, it's nice for a change and you can control the calorie content by going with full fat to low fat creme fraiche. (It's always tastes better full fat though obviously!) to serve 4: use 800g of potatoes, finely slice and boil in a pan for about 5-8 mins till firmish, not soft. Finely slice 3 onions and place in an oven dish with 2 tblsp of olive oil and 100ml of chicken stock. Cook till the onions are soft then drain the potatoes and pour onto the onions. Season and spoon over cream or creme fraiche till all is covered but not swimming. Grate Parmesan over the top then finish under the grill till nicely golden. serve with chicken and bacon, peas and spinach.",https://www.themealdb.com/images/media/meals/qwrtut1468418027.jpg,https://www.instagram.com/p/BHxR7hYBJ6P,"800g Potatoes, 3 Onions, 2 tblsp Olive Oil, 100ml Chicken Stock, 1 pot Creme Fraiche, Topping Parmesan, 4 Chicken Breasts, 4 Bacon, Topping Spinach, Topping Peas,  ,  ,  ,  ,  ,  ,  ,  ,  ,  "
Irish stew,Beef,Irish,"Heat the oven to 180C/350F/gas mark 4. Drain and rinse the soaked wheat, put it in a medium pan with lots of water, bring to a boil and simmer for an hour, until cooked. Drain and set aside.

Season the lamb with a teaspoon of salt and some black pepper. Put one tablespoon of oil in a large, deep sauté pan for which you have a lid; place on a medium-high heat. Add some of the lamb – don't overcrowd the pan – and sear for four minutes on all sides. Transfer to a bowl, and repeat with the remaining lamb, adding oil as needed.

Lower the heat to medium and add a tablespoon of oil to the pan. Add the shallots and fry for four minutes, until caramelised. Tip these into the lamb bowl, and repeat with the remaining vegetables until they are all nice and brown, adding more oil as you need it.

Once all the vegetables are seared and removed from the pan, add the wine along with the sugar, herbs, a teaspoon of salt and a good grind of black pepper. Boil on a high heat for about three minutes.

Tip the lamb, vegetables and whole wheat back into the pot, and add the stock. Cover and boil for five minutes, then transfer to the oven for an hour and a half.

Remove the stew from the oven and check the liquid; if there is a lot, remove the lid and boil for a few minutes.",https://www.themealdb.com/images/media/meals/sxxpst1468569714.jpg,http://www.ottolenghi.co.uk/recipes/meat/irish-stew-shop,"300g soaked overnight in water whole wheat, 2kg cut into 3cm cubes lamb loin chops, 120ml olive oil, 24 Skinned shallots, 4 large carrots, 2 turnips, 1 celeriac, 350g charlotte potatoes, 150ml white wine, 1 tsp caster sugar, 4 sprigs fresh thyme, 4 sprigs oregano, 450ml chicken stock,  ,  ,  ,  ,  ,  ,  "
Lamb tomato and sweet spices,Chicken,Moroccan,"Use pickled vine leaves here, preserved in brine. Small delicate leaves are better than the large bristly ones but, if only large leaves are to hand, then trim them to roughly 12 by 12 cms so that you don't get too many layers of leaves around the filling. And remove any stalks. Drain the preserved leaves, immerse them in boiling water for 10 minutes and then leave to dry on a tea towel before use. 
Basmati rice with butter and pine nuts is an ideal accompaniment. Couscous is great, too. Serves four.
First make the filling. Put all the ingredients, apart from the tomatoes, in a bowl. Cut the tomatoes in half, coarsely grate into the bowl and discard the skins. Add half a teaspoon of salt and some black pepper, and stir. Leave on the side, or in the fridge, for up to a day. Before using, gently squeeze with your hands and drain away any juices that come out.
To make the sauce, heat the oil in a medium pan. Add the ginger and garlic, cook for a minute or two, taking care not to burn them, then add the tomato, lemon juice and sugar. Season, and simmer for 20 minutes.
While the sauce is bubbling away, prepare the vine leaves. Use any torn or broken leaves to line the base of a wide, heavy saucepan. Trim any leaves from the fennel, cut it vertically into 0.5cm-thick slices and spread over the base of the pan to cover completely.
Lay a prepared vine leaf (see intro) on a work surface, veiny side up. Put two teaspoons of filling at the base of the leaf in a 2cm-long by 1cm-wide strip. Fold the sides of the leaf over the filling, then roll it tightly from bottom to top, in a cigar shape. Place in the pan, seam down, and repeat with the remaining leaves, placing them tightly next to each other in lines or circles (in two layers if necessary).
Pour the sauce over the leaves (and, if needed, add water just to cover). Place a plate on top, to weigh the leaves down, then cover with a lid. Bring to a boil, reduce the heat and cook on a bare simmer for 70 minutes. Most of the liquid should evaporate. Remove from the heat, and leave to cool a little - they are best served warm. When serving, bring to the table in the pan - it looks great. Serve a few vine leaves and fennel slices with warm rice. Spoon the braising juices on top and garnish with coriander.",https://www.themealdb.com/images/media/meals/qtwtss1468572261.jpg,http://www.ottolenghi.co.uk/recipes/meat/lamb-tomato-and-sweet-spices-shop,"2 tbsp olive oil, 4cm piece finely chopped ginger, 2 cloves peeled and chopped garlic, 800g peeled and chopped  tomatoes, 2 tbsp lemon juice, 1 tsp caster sugar, 50 vine leaves, 1 large fennel bulb, 400g lamb mince, 1 medium onion, 1 small peeled and coarsely grated potato, 2 tbsp basmati rice, 2 tbsp chopped parsley, 2 tbsp chopped coriander, 1 tbsp lemon juice, 2 cloves garlic, ½ tsp ground clove, ½ tsp ground  cinnamon, 2 medium tomatoes,  "
Rigatoni with fennel sausage sauce,Lamb,Moroccan,"Heat a tablespoon of oil in a large saute pan for which you have a lid. Add the sausage pieces and fry on a medium-high heat for 10 minutes, stirring regularly, until golden-brown all over. Transfer the sausages to a plate, then add the onion and fennel to the hot pan and fry for 15 minutes, stirring once in a while, until soft and caramelised; if the pan goes a bit dry, add a teaspoon or so of extra oil. Stir in the paprika, garlic and half the fennel seeds, fry for two minutes more, then pour on the wine and boil for 30 seconds, to reduce by half. Add the tomatoes, sugar, 100ml water, the seared sausage and half a teaspoon of salt, cover and simmer for 30 minutes; remove the lid after 10 minutes, and cook until the sauce is thick and rich. Remove from the heat, stir through the olives and remaining fennel seeds and set aside until you’re ready to serve.

Bring a large pot of salted water to a boil, add the pasta and cook for 12-14 minutes (or according to the instructions on the packet), until al dente. Meanwhile, reheat the sauce. Drain the pasta, return it to the pot, stir in a tablespoon of oil, then divide between the bowls. 

Put all the pesto ingredients except the basil in the small bowl of a food processor. Add a tablespoon of water and blitz to a rough paste. Add the basil, then blitz until just combined (the pesto has a much better texture if the basil is not overblended).

Spoon over the ragù and top with a spoonful of pesto. Finish with a sprinkling of chopped fennel fronds, if you have any, and serve at once.",https://www.themealdb.com/images/media/meals/qtqvys1468573168.jpg,http://www.ottolenghi.co.uk/recipes/meat/rigatoni-with-fennel-sausage-sauce-and-pecorino-and-anchovy-pesto-shop,"2½ tbsp olive oil, 6 cut into 1.5cm-thick slices Italian fennel sausages, 1 large peeled and chopped onion, 1 trimmed and roughly chopped; reserve any fronds to garnish fennel bulb, ½ tsp smoky paprika, 1 clove, peeled and sliced garlic, 2 tsp lightly toasted and then gently crushed fennel seeds, 100ml red wine, 400g tinned chopped tomatoes, ½ tsp caster sugar, 50g cut in half lengthways pitted black olives, 500g rigatoni, 30g roughly crumbled into 0.5cm pieces pecorino, 1  rinsed and patted dry anchovy fillet, 1 clove, peeled and crushed garlic, 60ml olive oil, 50g torn basil leaves,  ,  ,  "
