Meal,Category,Area,Instructions,MealThumb,Source,Ingredients
Katsu Chicken curry,Chicken,Japanese,"Prep:15min  ›  Cook:30min  ›  Ready in:45min 

For the curry sauce: Heat oil in medium non-stick saucepan, add onion and garlic and cook until softened. Stir in carrots and cook over low heat for 10 to 12 minutes.
Add flour and curry powder; cook for 1 minute. Gradually stir in stock until combined; add honey, soy sauce and bay leaf. Slowly bring to the boil.
Turn down heat and simmer for 20 minutes or until sauce thickens but is still of pouring consistency. Stir in garam masala. Pour the curry sauce through a sieve; return to saucepan and keep on low heat until ready to serve.
For the chicken: Season both sides of chicken breasts with salt and pepper. Place flour, egg and breadcrumbs in separate bowls and arrange in a row. Coat the chicken breasts in flour, then dip them into the egg, then coat in breadcrumbs, making sure you cover both sides.
Heat oil in large frying pan over medium-high heat. Place chicken into hot oil and cook until golden brown, about 3 or 4 minutes each side. Once cooked, place on kitchen paper to absorb excess oil.
Pour curry sauce over chicken, serve with white rice and enjoy!",https://www.themealdb.com/images/media/meals/vwrpps1503068729.jpg,http://allrecipes.co.uk/recipe/29578/chicken-katsu-curry.aspx,"4 pounded to 1cm thickness chicken breast, 2 tablespoons plain flour, 1 beaten egg, 100g fine breadcrumbs, 230ml frying vegetable oil, 2 tablespoons sunflower oil, 2 sliced onions, 5 chopped cloves garlic, 2 sliced carrot, 2 tablespoons plain flour, 4 teaspoons curry powder, 600ml chicken stock, 2 teaspoons honey, 4 teaspoons soy sauce, 1 bay leaf, 1 teaspoon garam masala,  ,  ,  ,  "
Laksa King Prawn Noodles,Seafood,Malaysian,"Heat the oil in a medium saucepan and add the chilli. Cook for 1 min, then add the curry paste, stir and cook for 1 min more. Dissolve the stock cube in a large jug in 700ml boiling water, then pour into the pan and stir to combine. Tip in the coconut milk and bring to the boil.
Add the fish sauce and a little seasoning. Toss in the noodles and cook for a further 3-4 mins until softening. Squeeze in the lime juice, add the prawns and cook through until warm, about 2-3 mins. Scatter over some of the coriander.
Serve in bowls with the remaining coriander and lime wedges on top for squeezing over.",https://www.themealdb.com/images/media/meals/rvypwy1503069308.jpg,https://www.bbcgoodfood.com/recipes/prawn-laksa-curry-bowl,"1 tbsp Olive Oil, 1 finely sliced red chili, 2 ½ tbsp Thai red curry paste, 1 vegetable stock cube, 400ml can coconut milk, 2 tsp fish sauce, 100g rice noodles, 2 juice of 1, the other halved lime, 150g king prawns, ½ small pack coriander,  ,  ,  ,  ,  ,  ,  ,  ,  ,  "
Toad In The Hole,Pork,British,"Preheat the oven to 200°C/fan180°C/gas 6. fry sausages in a non-stick pan until browned.
Drizzle vegetable oil in a 30cm x 25cm x 6cm deep roasting tray and heat in the oven for 5 minutes.
Put the plain flour in a bowl, crack in the medium free-range eggs, then stir in the grated horseradish. Gradually beat in the semi-skimmed milk. Season.
Put the sausages into the hot roasting tray and pour over the batter. Top with cherry tomatoes on the vine and cook for 30 minutes until puffed and golden.",https://www.themealdb.com/images/media/meals/ytuvwr1503070420.jpg,http://www.deliciousmagazine.co.uk/recipes/georgina-fuggles-horseradish-and-vine-tomato-toad-in-the-hole/,"8 sausages, 3 tbsp vegetable oil, 100g plain flour, 2 medium eggs, 1 tbsp grated horseradish, 225ml milk, 200g cherry tomatoes,  ,  ,  ,  ,  ,  ,  ,  ,  ,  ,  ,  ,  "
Salmon Prawn Risotto,Seafood,Italian,"Melt the butter in a thick-based pan and gently cook the onion without colour until it is soft.
Add the rice and stir to coat all the grains in the butter
Add the wine and cook gently stirring until it is absorbed
Gradually add the hot stock, stirring until each addition is absorbed. Keep stirring until the rice is tender
Season with the lemon juice and zest, and pepper to taste. (there will probably be sufficient saltiness from the salmon to not need to add salt) Stir gently to heat through
Serve scattered with the Parmesan and seasonal vegetables.
Grill the salmon and gently place onto the risotto with the prawns and asparagus",https://www.themealdb.com/images/media/meals/xxrxux1503070723.jpg,http://www.rangemaster.co.uk/rangemaster-owners/recipes-ideas-inspiration/recipes/mains/prawn-and-hot-smoked-salmon-risotto-with-asparagus,"50g/2oz butter, 1 finely chopped  onion, 150g rice, 125ml  white wine, 1 litre hot vegetable stock, The juice and zest of one lemon, 240g large King Prawns, 150g salmon, 100g tips blanched briefly in boiling water asparagus, ground black pepper, 50g shavings Parmesan,  ,  ,  ,  ,  ,  ,  ,  ,  "
Beef Sunday Roast,Beef,British,"Cook the Broccoli and Carrots in a pan of boiling water until tender.

Roast the Beef and Potatoes in the oven for 45mins, the potatoes may need to be checked regularly to not overcook.

To make the Yorkshire puddings:
Heat oven to 230C/fan 210C/gas 8. Drizzle a little sunflower oil evenly into 2 x 4-hole Yorkshire pudding tins or a 12-hole non-stick muffin tin and place in the oven to heat through
To make the batter, tip 140g plain flour into a bowl and beat in four eggs until smooth. Gradually add 200ml milk and carry on beating until the mix is completely lump-free. Season with salt and pepper. Pour the batter into a jug, then remove the hot tins from the oven. Carefully and evenly pour the batter into the holes. Place the tins back in the oven and leave undisturbed for 20-25 mins until the puddings have puffed up and browned. Serve immediately.

Plate up and add the Gravy as desired.",https://www.themealdb.com/images/media/meals/ssrrrs1503664277.jpg,https://www.bbcgoodfood.com/recipes/9020/best-yorkshire-puddings,"8 slices Beef, 12 florets Broccoli, 1 Packet Potatoes, 1 Packet Carrots, 140g plain flour, 4 Eggs, 200ml milk, drizzle (for cooking) sunflower oil,  ,  ,  ,  ,  ,  ,  ,  ,  ,  ,  ,  "
Braised Beef Chilli,Beef,Mexican,"Preheat the oven to 120C/225F/gas mark 1.

Take the meat out of the fridge to de-chill. Pulse the onions and garlic in a food processor until finely chopped. Heat 2 tbsp olive oil in a large casserole and sear the meat on all sides until golden.

Set to one side and add another small slug of oil to brown the chorizo. Remove and add the onion and garlic, spices, herbs and chillies then cook until soft in the chorizo oil. Season with salt and pepper and add the vinegar, tomatoes, ketchup and sugar.

Put all the meat back into the pot with 400ml water (or red wine if you prefer), bring up to a simmer and cook, covered, in the low oven.

After 2 hours, check the meat and add the beans. Cook for a further hour and just before serving, pull the meat apart with a pair of forks.",https://www.themealdb.com/images/media/meals/uuqvwu1504629254.jpg,http://www.telegraph.co.uk/food-and-drink/recipes/braised-beef-chilli-con-carne/,"1kg Beef, 3 Onions, 4 cloves Garlic, Dash Olive oil, 300g Chorizo, 2 tsp Cumin, 2 tsp All spice, 1 tsp Cloves, 1 large Cinnamon stick, 3 Bay Leaves, 2 tsp dried Oregano, 2 ancho Ancho Chillies, 3 tbsp Balsamic Vinegar, 2 x 400g Plum Tomatoes, 2 tbsp Tomato Ketchup, 2 tbsp Dark Brown Sugar, 2 x 400g tins Borlotti Beans,  ,  ,  "
Massaman Beef curry,Beef,Thai,"Heat oven to 200C/180C fan/gas 6, then roast the peanuts on a baking tray for 5 mins until golden brown. When cool enough to handle, roughly chop. Reduce oven to 180C/160C fan/gas 4.
Heat 2 tbsp coconut cream in a large casserole dish with a lid. Add the curry paste and fry for 1 min, then stir in the beef and fry until well coated and sealed. Stir in the rest of the coconut with half a can of water, the potatoes, onion, lime leaves, cinnamon, tamarind, sugar, fish sauce and most of the peanuts. Bring to a simmer, then cover and cook for 2 hrs in the oven until the beef is tender.
Sprinkle with sliced chilli and the remaining peanuts, then serve straight from the dish with jasmine rice.",https://www.themealdb.com/images/media/meals/tvttqv1504640475.jpg,https://www.bbcgoodfood.com/recipes/420631/beef-massaman-curry,"85g Peanuts, 400ml can Coconut cream, 4 tbsp Massaman curry paste, 600g stewing cut into strips Beef, 450g waxy Potatoes, 1 cut thin wedges Onion, 4 leaves Lime, 1 Cinnamon stick, 1 tbsp Tamarind paste, 1 tbsp palm or soft light Brown sugar, 1 tbsp Fish Sauce, 1 red deseeded and finely sliced, to serve chilli, to serve Jasmine Rice,  ,  ,  ,  ,  ,  ,  "
Vietnamese Grilled Pork (bun-thit-nuong),Pork,Vietnamese,"Slice the uncooked pork thinly, about ⅛"". It helps to slightly freeze it (optional).
Mince garlic and shallots. Mix in a bowl with sugar, fish sauce, thick soy sauce, pepper, and oil until sugar dissolves.
Marinate the meat for 1 hour, or overnight for better results.
Bake the pork at 375F for 10-15 minutes or until about 80% cooked. Finish cooking by broiling in the oven until a nice golden brown color develops, flipping the pieces midway.
Assemble your bowl with veggies, noodles, and garnish. Many like to mix the whole bowl up and pour the fish sauce on top, but I like to make individual bites and sauce it slowly.",https://www.themealdb.com/images/media/meals/qqwypw1504642429.jpg,http://www.hungryhuy.com/bun-thit-nuong-recipe-vietnamese-grilled-bbq-pork-with-rice-vermicelli-vegetables/,"1.5 pounds sliced Pork, 1 package thin Rice Vermicelli, 4-6 Egg Rolls, 3 tablespoons minced Challots, 1.5 tablespoons minced garlic Garlic, ¼ cup Sugar, 1 tablespoon Fish Sauce, ½ tablespoon thick Soy sauce, ½ tablespoon Pepper, 3 tablespoons Olive Oil, Sliced Cucumber, Leaves Mint, Crushed Peanuts,  ,  ,  ,  ,  ,  ,  "
Grilled Mac and Cheese Sandwich,Pasta,American,"Make the mac and cheese

1. Bring a medium saucepan of generously salted water (you want it to taste like seawater) to a boil. Add the pasta and cook, stirring occasionally, until al dente, 8 to 10 minutes, or according to the package directions. The pasta should be tender but still chewy.
2. While the pasta is cooking, in a small bowl, whisk together the flour, mustard powder, garlic powder, salt, black pepper, and cayenne pepper.
3. Drain the pasta in a colander. Place the empty pasta pan (no need to wash it) over low heat and add the butter. When the butter has melted, whisk in the flour mixture and continue to cook, whisking frequently, until the mixture is beginning to brown and has a pleasant, nutty aroma, about 1 minute. Watch carefully so it does not scorch on the bottom of the pan.
4. Slowly whisk the milk and cream into the flour mixture until everything is really well combined. Cook, whisking constantly, until the sauce is heated through and just begins to thicken, about 2 minutes. Remove from the heat. Gradually add the cheese while stirring constantly with a wooden spoon or silicone spatula and keep stirring until the cheese has melted into the sauce. Then stir in the drained cooked pasta.
5. Line a 9-by-13-inch (23-by-33-centimeter) rimmed baking sheet with parchment paper or aluminum foil. Coat the paper or foil with nonstick cooking spray or slick it with butter. Pour the warm mac and cheese onto the prepared baking sheet and spread it evenly with a spatula. Coat another piece of parchment paper with cooking spray or butter and place it, oiled or buttered side down, directly on the surface of the mac and cheese. Refrigerate until cool and firm, about 1 hour.

Make the grilled cheese
6. Heat a large cast-iron or nonstick skillet over medium-low heat.
7. In a small bowl, stir together the 4 tablespoons (55 grams) butter and garlic powder until well blended.
8. Remove the mac and cheese from the refrigerator and peel off the top layer of parchment paper. Carefully cut into 8 equal pieces. Each piece will make 1 grilled mac and cheese sandwich. (You can stash each individual portion in a double layer of resealable plastic bags and refrigerate for up to 3 days or freeze it for up to 1 month.)
9. Spread 3/4 teaspoon garlic butter on one side of each bread slice. Place half of the slices, buttered-side down, on a clean cutting board. Top each with one slice of Cheddar, then 1 piece of the mac and cheese. (Transfer from the baking sheet by scooting your hand or a spatula under each piece of mac and cheese and then flipping it over onto a sandwich.) Place 1 slice of Jack on top of each. Finish with the remaining bread slices, buttered-side up.
10. Using a wide spatula, place as many sandwiches in the pan as will fit without crowding it. Cover and cook until the bottoms are nicely browned, about 4 minutes. Turn and cook until the second sides are browned, the cheese is melted, and the mac and cheese is heated through, about 4 minutes more.
11. Repeat with the remaining ingredients. Cut the sandwiches in half, if desired, and serve.",https://www.themealdb.com/images/media/meals/xutquv1505330523.jpg,https://leitesculinaria.com/103647/recipes-grilled-mac-and-cheese-sandwich.html,"8 ounces (230 grams) Macaroni, 1/3 cup Plain Flour, 3/4 teaspoon Mustard Powder, 1/2 teaspoon Garlic powder, 1/2 teaspoon Kosher salt, 1/2 teaspoon Black pepper, 1/8 teaspoon Cayenne pepper, 6 tablespoons (85 grams) Butter, 1 1/2 cups (360 milliliters) Whole Milk, 1 cup (240 milliliters) Heavy Cream, 1 pound (455 grams)  Monterey Jack Cheese, 4 tablespoons (55 grams) Butter, 1 teaspoon garlic powder, 16 slices square Bread, 8 slices mild Cheddar Cheese, 8 slices Colby Jack Cheese, 4 tablespoons (55 grams) Butter,  ,  ,  "
Crock Pot Chicken Baked Tacos,Chicken,Mexican,"Put the uncooked chicken breasts in the crock pot. Pour the full bottle of salad dressing over the chicken. Sprinkle the rest of the ingredients over the top and mix them in a bit with a spoon.
Cover your crock pot with the lid and cook on high for 4 hours.
Remove all the chicken breasts from the crock pot and let cool.
Shred the chicken breasts and move to a glass bowl.
Pour most of the liquid over the shredded chicken.
FOR THE TACOS:
Make the guacamole sauce by mixing the avocado and green salsa together. Pour the guacamole mixture through a strainer until smooth and transfer to a squeeze bottle. Cut the tip off the lid of the squeeze bottle to make the opening more wide if needed.
Make the sour cream sauce by mixing the sour cream and milk together until you get a more liquid sour cream sauce. Transfer to a squeeze bottle.
In a 9x 13 glass baking dish, fill all 12+ tacos with a layer of refried beans, cooked chicken and shredded cheese.
Bake at 450 for 10-15 minutes just until the cheese is melted and bubbling.
Out of the oven top all the tacos with the sliced grape tomaotes, jalapeno and cilantro.
Finish with a drizzle of guacamole and sour cream.
Enjoy!",https://www.themealdb.com/images/media/meals/ypxvwv1505333929.jpg,http://www.nobiggie.net/crock-pot-chicken-baked-tacos/,"4 - 6 Chicken Breasts, 1 bottle Vinaigrette Dressing, 1½ tablespoon Cumin, 1 tablespoon Smoked Paprika, 1 teaspoon Garlic, 1 can Refried Beans, 12 Hard Taco Shells, 2 cups Shredded Mexican Cheese, Halved Grape Tomatoes, Sliced and Seeded Jalapeno, Peeled and Sliced Avocado, 2 tablespoons Green Salsa, 3 tablespoons Sour Cream, 1 tablespoon Milk,  ,  ,  ,  ,  ,  "
Chicken Karaage,Chicken,Japanese,"Add the ginger, garlic, soy sauce, sake and sugar to a bowl and whisk to combine. Add the chicken, then stir to coat evenly. Cover and refrigerate for at least 1 hour.

Add 1 inch of vegetable oil to a heavy bottomed pot and heat until the oil reaches 360 degrees F. Line a wire rack with 2 sheets of paper towels and get your tongs out. Put the potato starch in a bowl

Add a handful of chicken to the potato starch and toss to coat each piece evenly.

Fry the karaage in batches until the exterior is a medium brown and the chicken is cooked through. Transfer the fried chicken to the paper towel lined rack. If you want the karaage to stay crispy longer, you can fry the chicken a second time, until it's a darker color after it's cooled off once. Serve with lemon wedges.",https://www.themealdb.com/images/media/meals/tyywsw1505930373.jpg,https://norecipes.com/karaage-recipe,"450 grams Boneless skin Chicken thigh, 1 tablespoon Ginger, 1 clove Garlic, 2 tablespoons Soy sauce, 1 tablespoon Sake, 2 teaspoon Granulated sugar, 1/3 cup Potato starch, 1/3 cup Vegetable oil, 1/3 cup Lemon,  ,  ,  ,  ,  ,  ,  ,  ,  ,  ,  "
Coq au vin,Chicken,French,"Heat 1 tbsp of the oil in a large, heavy-based saucepan or flameproof dish. Tip in the bacon and fry until crisp. Remove and drain on kitchen paper. Add the shallots to the pan and fry, stirring or shaking the pan often, for 5-8 mins until well browned all over. Remove and set aside with the bacon.
Pat the chicken pieces dry with kitchen paper. Pour the remaining oil into the pan, then fry half the chicken pieces, turning regularly, for 5-8 mins until well browned. Remove, then repeat with the remaining chicken. Remove and set aside.
Scatter in the garlic and fry briefly, then, with the heat medium-high, pour in the brandy or Cognac, stirring the bottom of the pan to deglaze. The alcohol should sizzle and start to evaporate so there is not much left.
Return the chicken legs and thighs to the pan along with any juices, then pour in a little of the wine, stirring the bottom of the pan again. Stir in the rest of the wine, the stock and tomato purée, drop in the bouquet garni, season with pepper and a pinch of salt, then return the bacon and shallots to the pan. Cover, lower the heat to a gentle simmer, add the chicken breasts and cook for 50 mins-1hr.
Just before ready to serve, heat the oil for the mushrooms in a large non-stick frying pan. Add the mushrooms and fry over a high heat for a few mins until golden. Remove and keep warm.
Lift the chicken, shallots and bacon from the pan and transfer to a warmed serving dish. Remove the bouquet garni. To make the thickener, mix the flour, olive oil and butter in a small bowl using the back of a teaspoon. Bring the wine mixture to a gentle boil, then gradually drop in small pieces of the thickener, whisking each piece in using a wire whisk. Simmer for 1-2 mins. Scatter the mushrooms over the chicken, then pour over the wine sauce. Garnish with chopped parsley.",https://www.themealdb.com/images/media/meals/qstyvs1505931190.jpg,https://www.bbcgoodfood.com/recipes/1913655/coq-au-vin,"1½ tbsp Olive Oil, 3 rashers (100g) chopped dry-cured Bacon, 12 small Shallots, 2 (460g) Chicken Legs, 4 (650g) Chicken Thighs, 2 (280g) Chicken Breasts, 3 finely chopped Garlic, 3 tbsp Brandy, 600ml Red Wine, 150ml Chicken Stock, 2 tsp tomato puree, 3 sprigs thyme, 2 sprigs Rosemary, 2 bay leaves, garnish parsley, 250g chestnut mushroom, 2 tbsp plain flour, 1 tsp butter,  ,  "
Salted Caramel Cheescake,Desert,American,"1) Blitz the biscuits and the pretzels in a food processor and mix the biscuits with the melted butter. Spread on the bottom of an 8″/20cm Deep Springform Tin and press down firmly. Leave to set in the fridge whilst you make the rest!

2) Using an electric mixer, I use my KitchenAid with the whisk attachment, whisk together the cream cheese, vanilla, and icing sugar until smooth and then add the caramel and whisk again until smooth and lump free – this could take a couple of minutes, I whisk it at half speed so not too quick or slow!

3) Pour in the double cream & Salt flakes and continue to whisk for a couple of minutes until its very thick and mousse like (I mix it on a medium speed, level 6/10) – Now this could take up to 5 minutes depending on your mixer, but you seriously have to stick at it – it will hold itself completely when finished mixing (like a meringue does!) If you don’t mix it enough it will not set well enough, but don’t get impatient and whisk it really quick because that’ll make it split! Spread over the biscuit base and leave to set in the fridge overnight.

4) Remove the Cheesecake from the tin carefully and decorate the cheesecake – I drizzled over some of the spare caramel, and then some Toffee Popcorn and more Pretzels!",https://www.themealdb.com/images/media/meals/xqrwyr1511133646.jpg,http://www.janespatisserie.com/2015/11/09/no-bake-salted-caramel-cheesecake/,"250g Digestive Biscuits, 75g Pretzels, 135g Butter, 450g Cream Cheese, 1tsp Vanilla Extract, 100g  Icing Sugar, 150g Caramel, 1tsp Sea Salt, 300ml  Double Cream, drizzle Caramel Sauce, Top Toffee Popcorn, Top Pretzels,  ,  ,  ,  ,  ,  ,  ,  "
Beef stroganoff,Beef,Russian,"Heat the olive oil in a non-stick frying pan then add the sliced onion and cook on a medium heat until completely softened, so around 15 mins, adding a little splash of water if they start to stick at all. Crush in the garlic and cook for a 2-3 mins further, then add the butter. Once the butter is foaming a little, add the mushrooms and cook for around 5 mins until completely softened. Season everything well, then tip onto a plate.
Tip the flour into a bowl with a big pinch of salt and pepper, then toss the steak in the seasoned flour. Add the steak pieces to the pan, splashing in a little oil if the pan looks particularly dry, and fry for 3-4 mins, until well coloured. Tip the onions and mushrooms back into the pan. Whisk the crème fraîche, mustard and beef stock together, then pour into the pan. Cook over a medium heat for around 5 mins. Scatter with parsley, then serve with pappardelle or rice.",https://www.themealdb.com/images/media/meals/svprys1511176755.jpg,https://www.bbcgoodfood.com/recipes/beef-stroganoff,"1 tbls Olive Oil, 1 Onions, 1 clove Garlic, 1 tbsp Butter, 250g Mushrooms, 500g Beef Fillet, 1tbsp Plain Flour, 150g Creme Fraiche, 1 tbsp English Mustard, 100ml Beef Stock, Topping Parsley,  ,  ,  ,  ,  ,  ,  ,  ,  "
Fettucine alfredo,Pasta,Italian,"In a medium saucepan, stir the clotted cream, butter and cornflour over a low-ish heat and bring to a low simmer. Turn off the heat and keep warm.
Meanwhile, put the cheese and nutmeg in a small bowl and add a good grinding of black pepper, then stir everything together (don’t add any salt at this stage).
Put the pasta in another pan with 2 tsp salt, pour over some boiling water and cook following pack instructions (usually 3-4 mins). When cooked, scoop some of the cooking water into a heatproof jug or mug and drain the pasta, but not too thoroughly.
Add the pasta to the pan with the clotted cream mixture, then sprinkle over the cheese and gently fold everything together over a low heat using a rubber spatula. When combined, splash in 3 tbsp of the cooking water. At first, the pasta will look wet and sloppy: keep stirring until the water is absorbed and the sauce is glossy. Check the seasoning before transferring to heated bowls. Sprinkle over some chives or parsley, then serve immediately.",https://www.themealdb.com/images/media/meals/uquqtu1511178042.jpg,https://www.bbcgoodfood.com/recipes/fettucine-alfredo,"227g Clotted Cream, 25g Butter, 1 tsp  Corn Flour, 100g  Parmesan Cheese, Grated Nutmeg, 250g Fettuccine, Chopped Parsley,  ,  ,  ,  ,  ,  ,  ,  ,  ,  ,  ,  ,  "
Seafood fideuà,Seafood,Spanish,"Boil the kettle. Empty the mussels into a colander and run under cold water. Throw away any with broken shells. Pick through the shells, tapping each one on the side of the sink – they should be closed or should slowly close when tapped – if they stay open, throw them away. If any of the shells still have barnacles or stringy beards attached, pull them off with a cutlery knife and rinse the shells well. Keep in the colander, covered with a cold, damp cloth, until you’re ready to cook. Peel the prawn shells on the body section only – leave the heads and tails intact. Score down the backs and pull out any gritty entrails. Chill until you’re ready to cook.
Put the saffron in a small cup, cover with 50ml kettle-hot water and set aside for 10 mins. If using vermicelli, put in a bowl and crush to little pieces (about 1cm long) with your hands.
Heat the oil in a large frying pan with at least a 3cm lip, or a 40cm paella pan. Add the onion and stir around the pan for 5 mins until soft. Add the garlic and cook for 1 min more, then tip in the vermicelli and cook for 5 mins, stirring from time to time, until the vermicelli is toasted brown. Stir in the paprika.
Keeping the heat moderate, stir through the monkfish, squid and saffron with its water, seasoning well. Spread the ingredients out in an even layer, then pour over the hot stock and scatter the tomatoes on top. Bring to a simmer, then cover the whole dish with a tight-fitting lid (or foil). Turn the heat to medium and cook for 6 mins.
Uncover and stir to incorporate the dry top layer of pasta. Push the mussels into the pasta so the hinges are buried in the bottom of the dish, and they stand straight up. Arrange the prawns on top, cover tightly and cook for another 6 mins or until the mussels are open, the prawns are pink and the pasta is cooked through. Leave to simmer for another 2-3 mins to cook off most of the remaining liquid (leave a little in the pan to prevent the pasta from sticking together). Allow to sit for 2-3 mins, then squeeze over the lemon juice and arrange the wedges on top. Scatter with parsley before serving.",https://www.themealdb.com/images/media/meals/wqqvyq1511179730.jpg,https://www.bbcgoodfood.com/recipes/seafood-fideua-paella,"400g Mussels, 8 Prawns, 2 pinches Saffron, 350g Vermicelli, 5 tblsp  Olive Oil, 1 large Onions, 3 cloves Garlic, 2 tbs Paprika, 1 tail Monkfish, 4 Baby Squid, 650ml Fish Stock, 2 large Tomatoes, Juice of 1 Lemon, Topping Parsley,  ,  ,  ,  ,  ,  "
